{
  "$schema": "https://json-schema.org/draft/2020-12/schema",
  "$id": "urn:steelmatter:proposed:execution:1",
  "title": "execution proposed unsigned payload",
  "type": "object",
  "properties": {
    "schema_version": {
      "const": "1"
    },
    "crypto_profile": {
      "const": "SM-JWS-ES256-1"
    },
    "execution_id": {
      "type": "string",
      "minLength": 1,
      "maxLength": 128,
      "pattern": "^[A-Za-z0-9][A-Za-z0-9._:-]*$"
    },
    "operation_id": {
      "type": "string",
      "minLength": 1,
      "maxLength": 128,
      "pattern": "^[A-Za-z0-9][A-Za-z0-9._:-]*$"
    },
    "tenant_id": {
      "type": "string",
      "minLength": 1,
      "maxLength": 128,
      "pattern": "^[A-Za-z0-9][A-Za-z0-9._:-]*$"
    },
    "instruction_id": {
      "type": "string",
      "minLength": 1,
      "maxLength": 128,
      "pattern": "^[A-Za-z0-9][A-Za-z0-9._:-]*$"
    },
    "obligation_id": {
      "type": "string",
      "minLength": 1,
      "maxLength": 128,
      "pattern": "^[A-Za-z0-9][A-Za-z0-9._:-]*$"
    },
    "action_digest": {
      "type": "string",
      "pattern": "^[a-f0-9]{64}$"
    },
    "permit_digest": {
      "type": "string",
      "pattern": "^[a-f0-9]{64}$"
    },
    "target_order_id": {
      "type": "string",
      "minLength": 1,
      "maxLength": 128,
      "pattern": "^[A-Za-z0-9][A-Za-z0-9._:-]*$"
    },
    "currency": {
      "const": "INR"
    },
    "amount_minor": {
      "type": "integer",
      "minimum": 1,
      "maximum": 9007199254740991
    },
    "status": {
      "const": "COMMITTED"
    },
    "committed_at": {
      "type": "string",
      "format": "date-time",
      "pattern": "^\\d{4}-\\d{2}-\\d{2}T\\d{2}:\\d{2}:\\d{2}Z$"
    }
  },
  "required": [
    "schema_version",
    "crypto_profile",
    "execution_id",
    "operation_id",
    "tenant_id",
    "instruction_id",
    "obligation_id",
    "action_digest",
    "permit_digest",
    "target_order_id",
    "currency",
    "amount_minor",
    "status",
    "committed_at"
  ],
  "additionalProperties": false
}
